{
  "vocabulary": "set-role",
  "field": "WorkUnit.setRole",
  "specRef": "§5.5",
  "open": true,
  "description": "The role a single set plays (§5.5). Purely structural — position in a scheme, not terminal state. Spec canon: warmup, working, drop, backoff (with a named tail: cluster, myo, primer). Extended with rest_pause and top_set so the intra-set-rest family and top-set/back-off programming encode consistently. Terminal state (e.g. taken to failure) is a separate, orthogonal axis — see `terminated-by.json` (WorkUnit.performance.terminatedBy, §5.5) — and MAY be combined with any role here (e.g. a drop-set component taken to failure is `setRole: \"drop\"` + `terminatedBy: \"to_failure\"`).",
  "tokens": [
    { "token": "warmup", "label": "Warm-up Set", "description": "A submaximal preparatory set, typically excluded from working volume." },
    { "token": "working", "label": "Working Set", "description": "A counted set at the prescribed effort/load." },
    { "token": "top_set", "label": "Top Set", "description": "The heaviest set of an exercise (e.g. the AMRAP top set in 5/3/1)." },
    { "token": "backoff", "label": "Back-off Set", "aliases": ["back-off"], "description": "A lighter set following a heavier top set." },
    { "token": "drop", "label": "Drop Set Component", "description": "A post-first set at reduced load within a drop_set Block." },
    { "token": "rest_pause", "label": "Rest-Pause Component", "description": "A mini-set within a rest-pause Block, separated by a short rest." },
    { "token": "cluster", "label": "Cluster Component", "description": "A mini-set within a cluster set, separated by a short intra-set rest." },
    { "token": "myo", "label": "Myo-rep Component", "aliases": ["myo-reps"], "description": "An activation or mini-set within a myo-reps scheme." },
    { "token": "primer", "label": "Primer Set", "description": "A light potentiation/priming set before working sets." }
  ]
}
