{
  "vocabulary": "disciplines",
  "field": "Session.disciplines[]",
  "specRef": "§5.3",
  "open": true,
  "description": "Recommended-canon discipline tokens for a training Session. Open set (§5.9): a discipline with no token here is carried namespaced or opaque and still round-trips. Breadth-first seed across the three coverage buckets (popular, regional-niche, trending). One Session MAY carry several (multisport/hybrid).",
  "tokens": [
    { "token": "strength", "label": "Strength Training", "aliases": ["weight training", "resistance training", "lifting"], "description": "General resistance training for strength/hypertrophy." },
    { "token": "powerlifting", "label": "Powerlifting", "description": "Squat / bench / deadlift maximal-strength sport." },
    { "token": "weightlifting", "label": "Olympic Weightlifting", "aliases": ["olympic lifting", "oly"], "description": "Snatch and clean & jerk." },
    { "token": "bodybuilding", "label": "Bodybuilding", "description": "Physique-focused hypertrophy training." },
    { "token": "functional_fitness", "label": "Functional Fitness", "aliases": ["crossfit", "wod", "metcon"], "description": "Constantly-varied functional movements at high intensity (CrossFit-style)." },
    { "token": "hyrox", "label": "HYROX", "aliases": ["fitness racing", "gymrace", "deka"], "description": "Fixed-format functional fitness race: 8× (1 km run + functional station)." },
    { "token": "strongman", "label": "Strongman", "description": "Loaded carries, presses, stones, pulls — implement-based strength events." },
    { "token": "kettlebell_sport", "label": "Kettlebell Sport (Girevoy)", "aliases": ["girevoy", "gs"], "description": "Timed max-rep kettlebell snatch / jerk / long-cycle." },
    { "token": "calisthenics", "label": "Calisthenics", "aliases": ["street workout", "bodyweight"], "description": "Bodyweight strength and skill training." },
    { "token": "gymnastics", "label": "Gymnastics", "description": "Artistic/competitive gymnastics; judged skill execution." },
    { "token": "running", "label": "Running", "aliases": ["jog", "road running"], "description": "Road / treadmill / track running." },
    { "token": "trail_running", "label": "Trail Running", "aliases": ["mountain running", "ultra"], "description": "Off-road running incl. ultra/vert." },
    { "token": "cycling", "label": "Cycling", "aliases": ["road cycling", "indoor cycling", "spin"], "description": "Road / indoor / virtual cycling." },
    { "token": "mountain_biking", "label": "Mountain Biking", "aliases": ["mtb"], "description": "Off-road cycling." },
    { "token": "swimming", "label": "Swimming", "aliases": ["lap swimming", "pool swimming"], "description": "Pool or open-water swimming." },
    { "token": "rowing", "label": "Rowing", "aliases": ["erg", "indoor rowing", "crew"], "description": "On-water or ergometer rowing." },
    { "token": "triathlon", "label": "Triathlon", "aliases": ["multisport", "duathlon", "brick"], "description": "Swim-bike-run multisport." },
    { "token": "hiking", "label": "Hiking", "aliases": ["rucking", "trekking"], "description": "Walking over terrain, possibly loaded (ruck)." },
    { "token": "walking", "label": "Walking", "description": "Walking for fitness/transport." },
    { "token": "yoga", "label": "Yoga", "aliases": ["vinyasa", "hatha", "power yoga"], "description": "Posture/breath practice." },
    { "token": "pilates", "label": "Pilates", "aliases": ["reformer"], "description": "Core-focused controlled movement." },
    { "token": "mobility", "label": "Mobility", "aliases": ["movement prep", "cars"], "description": "Joint range-of-motion and movement quality work." },
    { "token": "stretching", "label": "Stretching", "aliases": ["flexibility"], "description": "Static / dynamic / PNF flexibility work." },
    { "token": "climbing", "label": "Climbing", "aliases": ["rock climbing", "sport climbing", "lead"], "description": "Roped rock/wall climbing." },
    { "token": "bouldering", "label": "Bouldering", "description": "Ropeless climbing on short walls/problems." },
    { "token": "boxing", "label": "Boxing", "description": "Striking sport — hands only." },
    { "token": "kickboxing", "label": "Kickboxing", "description": "Striking with hands and feet." },
    { "token": "muay_thai", "label": "Muay Thai", "aliases": ["thai boxing"], "description": "Eight-limb striking art." },
    { "token": "mma", "label": "Mixed Martial Arts", "description": "Combined striking and grappling." },
    { "token": "bjj", "label": "Brazilian Jiu-Jitsu", "aliases": ["jiu jitsu", "grappling"], "description": "Submission grappling." },
    { "token": "wrestling", "label": "Wrestling", "description": "Grappling sport — takedowns and control." },
    { "token": "judo", "label": "Judo", "description": "Throwing and grappling art." },
    { "token": "karate", "label": "Karate", "description": "Striking martial art." },
    { "token": "taekwondo", "label": "Taekwondo", "description": "Kicking-focused martial art." },
    { "token": "fencing", "label": "Fencing", "description": "Sword combat sport." },
    { "token": "martial_arts", "label": "Martial Arts (general)", "description": "Use a specific token where possible; this is the fallback." },
    { "token": "basketball", "label": "Basketball" },
    { "token": "football", "label": "Football (Soccer)", "aliases": ["soccer"], "description": "Association football." },
    { "token": "american_football", "label": "American Football" },
    { "token": "rugby", "label": "Rugby", "aliases": ["rugby union", "rugby league"] },
    { "token": "cricket", "label": "Cricket" },
    { "token": "baseball", "label": "Baseball", "aliases": ["softball"] },
    { "token": "volleyball", "label": "Volleyball", "aliases": ["beach volleyball"] },
    { "token": "tennis", "label": "Tennis" },
    { "token": "padel", "label": "Padel", "description": "Enclosed-court racquet sport (popular in Europe/LatAm)." },
    { "token": "pickleball", "label": "Pickleball", "description": "Paddle sport (fastest-growing US sport)." },
    { "token": "badminton", "label": "Badminton" },
    { "token": "squash", "label": "Squash" },
    { "token": "table_tennis", "label": "Table Tennis", "aliases": ["ping pong"] },
    { "token": "golf", "label": "Golf", "description": "Precision sport — scored via outcome (§5.18)." },
    { "token": "field_hockey", "label": "Field Hockey" },
    { "token": "ice_hockey", "label": "Ice Hockey", "aliases": ["hockey"] },
    { "token": "handball", "label": "Handball" },
    { "token": "netball", "label": "Netball" },
    { "token": "lacrosse", "label": "Lacrosse" },
    { "token": "skiing", "label": "Skiing", "aliases": ["alpine skiing", "cross-country skiing", "ski touring"] },
    { "token": "snowboarding", "label": "Snowboarding" },
    { "token": "skating", "label": "Skating", "aliases": ["ice skating", "inline skating", "skateboarding"] },
    { "token": "surfing", "label": "Surfing" },
    { "token": "paddling", "label": "Paddling", "aliases": ["kayaking", "canoeing", "sup", "paddleboarding"], "description": "Kayak / canoe / stand-up paddleboard." },
    { "token": "dance", "label": "Dance", "aliases": ["zumba", "barre"], "description": "Dance-based movement / fitness." },
    { "token": "parkour", "label": "Parkour", "aliases": ["freerunning"], "description": "Movement over obstacles." },
    { "token": "highland_games", "label": "Highland Games", "description": "Scottish heavy-throwing events (caber, stone, hammer)." },
    { "token": "kabaddi", "label": "Kabaddi", "description": "South Asian contact team sport (raids)." },
    { "token": "sepak_takraw", "label": "Sepak Takraw", "description": "Southeast Asian kick-volleyball." },
    { "token": "hurling", "label": "Hurling", "description": "Irish stick-and-ball field sport." },
    { "token": "gaelic_football", "label": "Gaelic Football", "description": "Irish field sport." },
    { "token": "aussie_rules", "label": "Australian Rules Football", "aliases": ["afl", "footy"] },
    { "token": "sumo", "label": "Sumo", "description": "Japanese grappling sport." },
    { "token": "mallakhamb", "label": "Mallakhamb", "description": "Indian pole/rope gymnastics." },
    { "token": "archery", "label": "Archery", "description": "Precision sport — scored via outcome (§5.18)." },
    { "token": "darts", "label": "Darts", "description": "Precision sport — scored via outcome (§5.18)." },
    { "token": "curling", "label": "Curling", "description": "Precision team sport." },
    { "token": "bowling", "label": "Bowling", "description": "Precision sport — scored via outcome (§5.18)." },
    { "token": "sauna", "label": "Sauna", "description": "Recovery/heat exposure — low-structure tagged session (§3.2)." },
    { "token": "cold_exposure", "label": "Cold Exposure", "aliases": ["cold plunge", "ice bath"], "description": "Recovery/cold exposure — low-structure tagged session (§3.2)." },
    { "token": "breathwork", "label": "Breathwork", "aliases": ["wim hof", "pranayama"], "description": "Breathing practice (pairs with phasePattern + to_breath, §5.10/§5.15)." },
    { "token": "meditation", "label": "Meditation", "aliases": ["mindfulness"], "description": "Recovery/wellness — low-structure tagged session (§3.2)." }
  ]
}
